column,change,rationale
age,Removed 3 row(s) where age > 125,Oldest verified human lived to be 122; values above 125 are likely errors or outliers.
loan_status,Dropped loan_status column,Target variable for classification; not needed in cleaned dataset.
person_income,"Capped person_income at $3,000,000 and applied log1p transformation",Handled extreme right skew and outliers in income distribution; log1p applied to normalize values and removed person_income for modeling.
loan_amnt,Applied log1p transformation to loan_amount,Handled extreme right skew and outliers in loan amount distribution; log1p applied to normalize values.
person_emp_exp,Removed 5 row(s) where person_emp_exp > 70,Unrealistic employment experience; values above 70 years are likely errors or outliers.
person_education,Combined Master and Doctorate categories into one group -- Graduate,Doctorate had the lowest frequency out of all the categories which could impact analysis
person_home_ownership,Combined RENT and OTHER into Non-Homeowner category and MORTGAGE and OWN into Homeowner category,RENT and MORTGAGE had high frequencies while OWN and OTHER had low frequencies which could impact analysis
"['person_gender', 'loan_intent', 'previous_loan_defaults_on_file', 'person_education_new', 'person_home_ownership_new']",Applied one-hot encoding (drop_first=True),Converted categorical variables into binary indicators for model compatibility.
loan_status,Readded loan_status column,Target variable for classification; readded after cleaning and preprocessing.
